Unstructured_Description,SKU_Original
Nordic Vest in Charcoal size XXL Nylon,SKU1000017
fleece essential brand charcoal parka in L size,SKU1000058
nylon jacket Premium brand in blue xs,SKU1000138
breathable elite gray fleece t-shirt in m,SKU1000175
brown polo style polyester in xxl,SKU1000230
classic brown polyester blouse in s,SKU1000245
style shirt polyester cream color in s,SKU1000256
quick dry silk shirt navy xl,SKU1000280
comfort brown cotton t-shirt  in l,SKU1000313
urban navy jeans in xl no wrinkles,SKU1000326
fleece shorts in charcoal large size,SKU1000338
modern grey leather shorts in xl,SKU1000378
stretchy red skirt in size s preferrably by nordic,SKU1000422
i am looking for a pair of stretchy green cashmere pants in xxl,SKU1000460
searching for some brown stretchy dresses in m preferably nylon ,SKU1000490
do you happen to have a nordic xl gray sundress that dries quickly?,SKU1000512
do you have a red denim mini dress from style in size l?,SKU1000534
i saw a charcoal classic wool dress is it available?,SKU1000570
i want a breathable cashmere dress in burgundy size xs,SKU1000610
do you have any linen dresses in olive color? my size is m ,SKU1000628
looking for a pair of leather olive heels in size xl that are also waterproof,SKU1000659
i wnt some reed sneakers for this fall in size s,SKU1000691
comfort fleece cream loafers s breathable,SKU1000713
alpine boots in gray xl ,SKU1000730
beige xl blend stretchy sneakers for the winter,SKU1000756
black boots size xxl in cowboy style,SKU1000795
comfort leather loafers in tan size m,SKU1000678
stretchy red wool skirt size xl,SKU1000457
